{"project_version": "0.6.0", "execution_profile": "modular-spatial-v1", "random_seed": 1, "id": "chip-mcp-zero", "domain": {"geometry": "volume", "counts_xyz": [20, 40, 10], "spacing_um_xyz": [20.0, 20.0, 20.0]}, "species": {"ligand": {"concentration_unit": "uM", "initial_concentration": {"value": 100.0, "unit": "uM", "provenance": {"kind": "example", "reference": "Team plan: 0 uM low-side target. The initially linear field evolves through finite boundary exchange and diffusion. Establishment in the actual gel chip is unmeasured."}}}}, "groups": {"cells": {"ids": ["cell-0000", "cell-0001", "cell-0002", "cell-0003", "cell-0004", "cell-0005", "cell-0006", "cell-0007", "cell-0008", "cell-0009", "cell-0010", "cell-0011", "cell-0012", "cell-0013", "cell-0014", "cell-0015", "cell-0016", "cell-0017", "cell-0018", "cell-0019", "cell-0020", "cell-0021", "cell-0022", "cell-0023", "cell-0024", "cell-0025", "cell-0026", "cell-0027", "cell-0028", "cell-0029", "cell-0030", "cell-0031", "cell-0032", "cell-0033", "cell-0034", "cell-0035", "cell-0036", "cell-0037", "cell-0038", "cell-0039", "cell-0040", "cell-0041", "cell-0042", "cell-0043", "cell-0044", "cell-0045", "cell-0046", "cell-0047", "cell-0048", "cell-0049", "cell-0050", "cell-0051", "cell-0052", "cell-0053", "cell-0054", "cell-0055", "cell-0056", "cell-0057", "cell-0058", "cell-0059", "cell-0060", "cell-0061", "cell-0062", "cell-0063", "cell-0064", "cell-0065", "cell-0066", "cell-0067", "cell-0068", "cell-0069", "cell-0070", "cell-0071", "cell-0072", "cell-0073", "cell-0074", "cell-0075", "cell-0076", "cell-0077", "cell-0078", "cell-0079", "cell-0080", "cell-0081", "cell-0082", "cell-0083", "cell-0084", "cell-0085", "cell-0086", "cell-0087", "cell-0088", "cell-0089", "cell-0090", "cell-0091", "cell-0092", "cell-0093", "cell-0094", "cell-0095", "cell-0096", "cell-0097", "cell-0098", "cell-0099", "cell-0100", "cell-0101", "cell-0102", "cell-0103", "cell-0104", "cell-0105", "cell-0106", "cell-0107", "cell-0108", "cell-0109", "cell-0110", "cell-0111", "cell-0112", "cell-0113", "cell-0114", "cell-0115", "cell-0116", "cell-0117", "cell-0118", "cell-0119", "cell-0120", "cell-0121", "cell-0122", "cell-0123", "cell-0124", "cell-0125", "cell-0126", "cell-0127", "cell-0128", "cell-0129", "cell-0130", "cell-0131", "cell-0132", "cell-0133", "cell-0134", "cell-0135", "cell-0136", "cell-0137", "cell-0138", "cell-0139", "cell-0140", "cell-0141", "cell-0142", "cell-0143", "cell-0144", "cell-0145", "cell-0146", "cell-0147", "cell-0148", "cell-0149", "cell-0150", "cell-0151", "cell-0152", "cell-0153", "cell-0154", "cell-0155", "cell-0156", "cell-0157", "cell-0158", "cell-0159", "cell-0160", "cell-0161", "cell-0162", "cell-0163", "cell-0164", "cell-0165", "cell-0166", "cell-0167", "cell-0168", "cell-0169", "cell-0170", "cell-0171", "cell-0172", "cell-0173", "cell-0174", "cell-0175", "cell-0176", "cell-0177", "cell-0178", "cell-0179", "cell-0180", "cell-0181", "cell-0182", "cell-0183", "cell-0184", "cell-0185", "cell-0186", "cell-0187", "cell-0188", "cell-0189", "cell-0190", "cell-0191", "cell-0192", "cell-0193", "cell-0194", "cell-0195", "cell-0196", "cell-0197", "cell-0198", "cell-0199"], "positions_um": [[204.65772013190116, 757.6681748827926, 30.25528409304821], [376.7678821720741, 250.59417289632546, 84.97198399862482], [329.11482196525407, 327.90411427711405, 109.72036278391965], [13.858290617768937, 601.2894082877964, 107.47608939097853], [132.91429630064232, 629.012390522153, 61.426186541162416], [181.6781684553767, 109.4291076142488, 81.01014534363733], [83.16136482640295, 211.2767923108285, 149.0714758354903], [113.48105064649972, 388.24163369871826, 194.22449116104278], [381.892934303532, 578.4832129741857, 108.08046368729711], [112.09513439387611, 130.55769496745074, 192.105380990362], [206.3310227058642, 94.99729630179164, 124.20399208535008], [309.0131470508654, 489.7246210361141, 181.79035013901694], [18.599593405695927, 422.6998750284572, 92.02983304553914], [27.565734185050985, 512.2145662966636, 169.11603634220873], [236.6187611330879, 209.51737350335523, 166.61677812215612], [203.74137731947468, 408.6457742664272, 149.59392070962687], [61.28128209927288, 653.7836149807059, 135.92423357663841], [313.1161949725916, 155.1433096619874, 159.26337558236787], [78.3816268665369, 67.7527781866291, 169.62448696026576], [342.34569749400134, 698.970454554765, 94.49430499432289], [110.975065113805, 8.630911910914012, 128.56129553268977], [286.64429710242507, 666.4419579012177, 57.24805416345026], [87.7959578622116, 510.62911577287076, 159.7907472964219], [382.6863239009185, 122.51671535441491, 96.51362808706996], [355.51804970529236, 338.6372241146772, 117.54240416847342], [12.649326932385101, 537.7271503994335, 182.1413694482292], [328.7691798453481, 706.1030917676977, 131.42965458202258], [99.74759329381196, 613.2024971236259, 43.48824955107206], [330.52228485779773, 52.798030521189986, 163.79561142513694], [67.8158629907959, 300.86671521833364, 64.080680645165], [275.3867918994301, 144.78607127045132, 79.66620779452934], [5.294890472544493, 211.4208019235806, 84.55300758887523], [44.73296726268583, 505.7289971530269, 76.56315689776034], [288.7658116020381, 522.1696127883051, 86.52044276037161], [344.7242792230265, 504.9152832951326, 160.81377301283462], [137.66712123240453, 434.67341599675376, 40.47418948249167], [395.4796289067394, 196.11307865922373, 52.34602357651214], [31.836888522040596, 207.69567648340885, 151.57319237863442], [277.97006684913407, 105.16653057983254, 75.74274627990647], [168.8430294792804, 530.9974916113969, 91.36207675657478], [234.08822076925938, 669.7095752655002, 144.3888276212246], [146.8128618223722, 359.02666961952053, 74.06911565924129], [46.23545761863851, 164.3737860053929, 57.62607183304969], [126.76875486730707, 251.55999990303053, 115.0331443855786], [385.84585039418334, 618.0833231294432, 157.06225384186982], [302.1517892125945, 477.0082580358626, 181.8676824054989], [274.7142812461499, 400.28300600507555, 17.108426466105595], [195.4489954716964, 171.98781030022548, 28.0084743191703], [202.38957947657295, 626.3577223219854, 59.821262789881814], [305.89607340421156, 420.34984139082974, 31.213412580659657], [383.1972911280159, 321.8991617674829, 59.86591410988837], [336.7173580296895, 101.82150401729099, 145.78373037044588], [77.00294857079452, 314.63847015399045, 47.45237617857914], [334.44382912080044, 312.7191942402502, 193.0397913249287], [249.35302485955205, 553.7365307541147, 104.21892393795383], [124.7334704357829, 317.0717983156284, 186.42310078173273], [82.2740610855178, 787.6458075688486, 150.62794895274843], [144.75604903808843, 512.361790067449, 76.67238170144516], [153.30821546012848, 403.0195424544565, 5.277673040533909], [197.46719461769808, 774.4491402768291, 57.95118484197338], [297.7978758761852, 354.57437871597307, 43.01908435308595], [359.57101290234306, 16.36086403608912, 61.48774961350409], [396.6161976356314, 211.14455617485166, 168.41272628441732], [241.63916057034749, 642.9923517765361, 125.54228006692173], [145.90256168079225, 607.0662949592852, 7.190971585178579], [179.04430298337405, 298.2525284768642, 95.50650510492049], [53.28255047945143, 179.67045156134031, 112.16211165954304], [155.78103156844585, 631.5750272387304, 120.60677149839283], [342.33907380607565, 584.49450483653, 119.95739576067874], [116.3205472652223, 624.5118115333778, 51.24844532153203], [32.633178054875344, 767.5144752839229, 107.84219619890796], [307.91435323462565, 423.20290925850594, 121.869627152877], [16.353546703503458, 151.31418140692398, 134.2391215052164], [227.8024515932843, 128.89269698544985, 188.5977366703322], [63.8153312236773, 408.18078029251615, 30.224563503774505], [285.64446008585645, 222.39253319155128, 28.29025912386952], [21.11894918418317, 141.81941709071316, 39.592548477819015], [214.56699935128628, 361.1248756200846, 189.62969598169332], [378.9356267254571, 635.4576117119337, 133.63117626021784], [335.9390980779285, 748.3689518130284, 6.433074861852539], [49.53345949743832, 289.0495244388126, 20.343023196349545], [239.2126423829912, 209.72919254439824, 53.8105869099358], [116.60122752725904, 80.5862321220057, 147.22511283467915], [259.3649372622621, 484.56742396916235, 8.672934126443984], [172.20887298771774, 547.051650380475, 32.64394338110293], [154.94919079507503, 18.74831150312989, 18.044167427139445], [88.28271051962724, 332.2322279461514, 92.79504711232646], [351.5014834575365, 254.42680308616656, 6.20691975032951], [328.5319986278391, 52.106466686616784, 20.226430561796757], [382.4935963954556, 601.1721419939166, 68.21942374473399], [55.0784635979631, 310.0640750984581, 68.48219898491402], [347.52983336833444, 335.48989574734776, 18.080821179061918], [368.161249729283, 497.11681078991654, 24.87513192907643], [47.5906190582904, 372.95099348442585, 20.049437275066772], [251.91036372788685, 492.40873012935873, 8.287944329158126], [321.12457573027, 627.7150401859618, 181.40042064860046], [267.10081881495995, 553.1326124741672, 34.09336427282091], [12.412192707651812, 55.05714302022542, 191.03442267143004], [257.4142180304956, 754.8438931957654, 70.47933433893074], [300.55730120459714, 54.926778497163426, 34.57621245622235], [112.19053393956406, 439.9526918503889, 111.25214049781837], [199.60066220896385, 340.02408619786956, 114.83821142646332], [383.8649837828083, 366.71517102597863, 166.14439867248734], [25.01355422255725, 309.15628224066575, 111.85730295391024], [247.40629892804523, 201.51456190601695, 80.26103864337267], [376.1204304818619, 518.1874986854875, 116.65338468880974], [28.727691944817327, 44.427948568659275, 43.434095775084664], [57.30217368436141, 784.0974438429904, 2.5384409301221726], [147.14235049712374, 49.387425001298475, 127.44206943026461], [21.33408161749449, 57.31725062012751, 17.6687310991913], [110.08334173333452, 460.62830598934056, 159.86792905564732], [108.27348429349675, 227.83781891615632, 163.59850021457964], [296.9036617894711, 103.6909101957237, 160.04439120244595], [330.51293680230